{
  "$schema": "https://json-schema.org/draft/2020-12/schema",
  "$id": "fixture.schema.json",
  "title": "Nexus Conformance Test Fixture",
  "description": "Declarative test case for Nexus MCP tool behavioral verification. Each fixture must declare exactly one of: action (single tool invocation), event (single lifecycle event), or steps (multi-step sequence).",
  "type": "object",
  "additionalProperties": false,
  "required": ["test_id", "description", "covers"],
  "oneOf": [
    {
      "required": ["action"],
      "properties": {
        "action": true,
        "event": false,
        "steps": false
      }
    },
    {
      "required": ["event"],
      "properties": {
        "action": false,
        "event": true,
        "steps": false
      }
    },
    {
      "required": ["steps"],
      "properties": {
        "action": false,
        "event": false,
        "steps": true
      }
    }
  ],
  "properties": {
    "test_id": {
      "type": "string",
      "pattern": "^[a-z][a-z0-9_-]*$",
      "description": "Unique identifier for this fixture, used for reporting"
    },
    "description": {
      "type": "string",
      "minLength": 10,
      "description": "Human-readable description of what behavior this fixture verifies"
    },
    "covers": {
      "type": "object",
      "description": "Declaration of which schema fields and return value paths this fixture verifies. At least one of state_schemas or return_value must be non-empty.",
      "additionalProperties": false,
      "anyOf": [
        {
          "properties": {
            "state_schemas": {
              "minProperties": 1
            }
          },
          "required": ["state_schemas"]
        },
        {
          "properties": {
            "return_value": {
              "minProperties": 1
            }
          },
          "required": ["return_value"]
        }
      ],
      "properties": {
        "state_schemas": {
          "type": "object",
          "description": "Map of state-schema filename (e.g. 'plan.schema.json') to array of field paths verified by this fixture's postcondition. Field paths use dot-notation with array index notation (e.g. 'issues[].status').",
          "additionalProperties": {
            "type": "array",
            "items": {
              "type": "string",
              "pattern": "^[^ ]+$",
              "description": "Field path within the named schema (e.g. 'id', 'issues[].status', 'issues[].how_agents')"
            }
          }
        },
        "return_value": {
          "type": "object",
          "description": "Map of abstract tool name (e.g. 'plan_start') to array of return-value field paths verified by this fixture's postcondition.",
          "additionalProperties": {
            "type": "array",
            "items": {
              "type": "string",
              "pattern": "^[^ ]+$",
              "description": "Field path within the tool's return value (e.g. 'created', 'plan_id', 'issueCount')"
            }
          }
        },
        "description": {
          "type": "string",
          "description": "Optional human-readable explanation of coverage rationale or known gaps"
        }
      }
    },
    "uncovered_params": {
      "type": "array",
      "description": "Params intentionally excluded from postcondition verification. Validators treat entries here as explicit exceptions rather than coverage gaps, preventing false anti-pattern warnings.",
      "items": {
        "type": "string",
        "pattern": "^[^ ]+$",
        "description": "Parameter name from the action or event params that is deliberately not verified"
      }
    },
    "precondition": {
      "type": "object",
      "description": "State that must be established before the action or steps are executed",
      "additionalProperties": false,
      "properties": {
        "state_files": {
          "type": "object",
          "description": "Map of file path to content object. File path keys may contain placeholder tokens that a conformance runner must expand before resolving paths. Allowed tokens: {STATE_ROOT} (the root directory for all harness state, e.g. '.nexus/state') and {HARNESS_ID} (the harness identifier, resolved from event.params.harness_id or equivalent context). No other arbitrary tokens are permitted. Example key: '{STATE_ROOT}/{HARNESS_ID}/agent-tracker.json'. null value = file must not exist; empty object {} = file must exist but content is not inspected (use for non-JSON artifacts like .md, .txt, binary files); non-empty object = precondition content written as-is (typically JSON).",
          "additionalProperties": {
            "oneOf": [
              { "type": "object" },
              { "type": "null" }
            ]
          }
        }
      }
    },
    "action": {
      "$ref": "#/$defs/action",
      "description": "Single tool invocation — use for single-action fixtures; mutually exclusive with event and steps"
    },
    "event": {
      "$ref": "#/$defs/event",
      "description": "Single lifecycle event — use for event-based fixtures that require no tool call; mutually exclusive with action and steps"
    },
    "steps": {
      "type": "array",
      "description": "Ordered sequence of tool invocations or lifecycle events with per-step assertions — use for multi-step scenarios; mutually exclusive with action and event",
      "minItems": 1,
      "items": { "$ref": "#/$defs/step" }
    },
    "postcondition": {
      "$ref": "#/$defs/postcondition",
      "description": "Assertions evaluated after the action (or all steps) complete"
    }
  },
  "$defs": {
    "action": {
      "type": "object",
      "description": "A single tool invocation",
      "additionalProperties": false,
      "required": ["tool", "params"],
      "properties": {
        "tool": {
          "type": "string",
          "description": "Abstract tool name (e.g. plan_start, task_add). Must not include harness-specific prefixes."
        },
        "params": {
          "type": "object",
          "description": "Input parameters passed verbatim to the tool"
        }
      }
    },
    "event": {
      "type": "object",
      "description": "A lifecycle event that triggers harness-level behavior without a direct tool call. Used for verifying agent-tracker.json state changes.",
      "additionalProperties": false,
      "required": ["type"],
      "properties": {
        "type": {
          "type": "string",
          "enum": ["agent_spawn", "agent_complete", "agent_resume", "session_end"],
          "description": "Lifecycle event type. agent_spawn/agent_complete/agent_resume: agent instance lifecycle. session_end: session teardown — agent-tracker.json deleted, history/memory/context/rules preserved."
        },
        "params": {
          "type": "object",
          "description": "Optional event-specific parameters (e.g. harness_id, agent_name, and agent_id for agent_spawn)",
          "additionalProperties": true
        },
        "description": {
          "type": "string",
          "description": "Optional human-readable explanation of the event and its expected effect"
        }
      }
    },
    "postcondition": {
      "type": "object",
      "description": "Assertions on the state and return value after the action completes",
      "additionalProperties": false,
      "properties": {
        "state_files": {
          "type": "object",
          "description": "Map of file path to assertion object. File path keys may contain placeholder tokens that a conformance runner must expand before resolving paths. Allowed tokens: {STATE_ROOT} and {HARNESS_ID} only — no other arbitrary tokens are permitted. See precondition.state_files for token semantics. null = file must not exist after the action; empty object {} = file must exist but content is not inspected (use for non-JSON artifacts like .md, .txt, binary files); non-empty object = JSONPath assertions on parsed JSON content.",
          "additionalProperties": {
            "oneOf": [
              {
                "type": "object",
                "description": "JSONPath assertions on the file content. Keys are JSONPath expressions, values are expected values or matcher objects.",
                "additionalProperties": {
                  "oneOf": [
                    { "type": "string" },
                    { "type": "number" },
                    { "type": "boolean" },
                    { "type": "null" },
                    {
                      "type": "object",
                      "description": "Matcher object for type checks and range assertions",
                      "required": ["type"],
                      "properties": {
                        "type": {
                          "type": "string",
                          "enum": ["iso8601", "string", "number", "boolean"],
                          "description": "Expected value type"
                        },
                        "min": {
                          "type": "number",
                          "description": "Minimum numeric value (for type: number)"
                        },
                        "max": {
                          "type": "number",
                          "description": "Maximum numeric value (for type: number)"
                        },
                        "minLength": {
                          "type": "number",
                          "description": "Minimum string length (for type: string)"
                        },
                        "pattern": {
                          "type": "string",
                          "description": "Regex pattern the value must match (for type: string)"
                        }
                      }
                    }
                  ]
                }
              },
              { "type": "null" }
            ]
          }
        },
        "return_value": {
          "type": "object",
          "description": "JSONPath assertions on the tool return value. Same assertion syntax as state_files entries.",
          "additionalProperties": {
            "oneOf": [
              { "type": "string" },
              { "type": "number" },
              { "type": "boolean" },
              { "type": "null" },
              {
                "type": "object",
                "required": ["type"],
                "properties": {
                  "type": { "type": "string", "enum": ["iso8601", "string", "number", "boolean"] },
                  "min": { "type": "number" },
                  "max": { "type": "number" },
                  "minLength": { "type": "number" },
                  "pattern": { "type": "string" }
                }
              }
            ]
          }
        },
        "error": {
          "type": "boolean",
          "description": "If true, the action must produce an error response"
        },
        "error_contains": {
          "type": "string",
          "description": "The error message must contain this substring (implies error: true)"
        }
      }
    },
    "step": {
      "type": "object",
      "description": "One step in a multi-step scenario. Each step must contain exactly one of: action (tool invocation) or event (lifecycle event).",
      "additionalProperties": false,
      "oneOf": [
        {
          "required": ["action"],
          "properties": {
            "action": true,
            "event": false
          }
        },
        {
          "required": ["event"],
          "properties": {
            "action": false,
            "event": true
          }
        }
      ],
      "properties": {
        "description": {
          "type": "string",
          "description": "Optional human-readable label for this step"
        },
        "action": { "$ref": "#/$defs/action" },
        "event": { "$ref": "#/$defs/event" },
        "assert_return": {
          "type": "object",
          "description": "JSONPath assertions on the return value of this step's action",
          "additionalProperties": {
            "oneOf": [
              { "type": "string" },
              { "type": "number" },
              { "type": "boolean" },
              { "type": "null" },
              {
                "type": "object",
                "required": ["type"],
                "properties": {
                  "type": { "type": "string", "enum": ["iso8601", "string", "number", "boolean"] },
                  "min": { "type": "number" },
                  "max": { "type": "number" },
                  "minLength": { "type": "number" },
                  "pattern": { "type": "string" }
                }
              }
            ]
          }
        },
        "assert_state": {
          "type": "object",
          "description": "Map of file path to assertions on state files after this step completes. null means file must not exist.",
          "additionalProperties": {
            "oneOf": [
              {
                "type": "object",
                "additionalProperties": {
                  "oneOf": [
                    { "type": "string" },
                    { "type": "number" },
                    { "type": "boolean" },
                    { "type": "null" },
                    {
                      "type": "object",
                      "required": ["type"],
                      "properties": {
                        "type": { "type": "string", "enum": ["iso8601", "string", "number", "boolean"] },
                        "min": { "type": "number" },
                        "max": { "type": "number" },
                        "minLength": { "type": "number" },
                        "pattern": { "type": "string" }
                      }
                    }
                  ]
                }
              },
              { "type": "null" }
            ]
          }
        }
      }
    }
  }
}
