{
  "test_id": "agent_resume",
  "description": "Verifies that agent_resume transitions a completed agent back to running status and increments resume_count and sets last_resumed_at",
  "precondition": {
    "state_files": {
      ".nexus/state/agent-tracker.json": [
        {
          "agent_type": "claude-nexus:engineer",
          "agent_id": "uuid-eng01",
          "started_at": "2026-04-13T00:00:00.000Z",
          "resume_count": 0,
          "status": "completed",
          "stopped_at": "2026-04-13T01:00:00.000Z",
          "last_message": "Implementation complete",
          "files_touched": ["src/foo.ts", "src/bar.ts"]
        }
      ]
    }
  },
  "event": {
    "type": "agent_resume",
    "params": {
      "agent_id": "uuid-eng01"
    },
    "description": "Harness resumes a previously completed agent, incrementing the resume counter and updating lifecycle timestamps"
  },
  "postcondition": {
    "state_files": {
      ".nexus/state/agent-tracker.json": {
        "$.length": 1,
        "$[0].status": "running",
        "$[0].resume_count": 1,
        "$[0].last_resumed_at": { "type": "iso8601" }
      }
    }
  },
  "covers": {
    "state_schemas": {
      "agent-tracker.schema.json": ["last_resumed_at", "resume_count", "status"]
    }
  }
}
