[
  {
    "test_id": "task_add_happy_path",
    "description": "task_add creates tasks.json with the new task when no tasks.json existed, assigning id=1 and status=pending",
    "covers": {
      "state_schemas": {
        "tasks.schema.json": ["schema_version", "tasks[].id", "tasks[].title", "tasks[].status", "tasks[].deps", "tasks[].approach", "tasks[].acceptance", "tasks[].risk", "tasks[].context", "tasks[].created_at"]
      },
      "return_value": {
        "task_add": ["task"]
      }
    },
    "precondition": {
      "state_files": {
        ".nexus/state/tasks.json": null
      }
    },
    "action": {
      "tool": "task_add",
      "params": {
        "title": "Create fixture.schema.json",
        "context": "Define the JSON Schema that validates conformance test fixture files",
        "deps": [],
        "approach": "Write schema incrementally, validating against draft/2020-12 spec",
        "acceptance": "All 6 fixture files validate against the schema without errors",
        "risk": "JSONPath assertion syntax may need iteration to be harness-implementable"
      }
    },
    "postcondition": {
      "return_value": {
        "$.task.id": 1,
        "$.task.title": "Create fixture.schema.json",
        "$.task.status": "pending",
        "$.task.deps.length": 0,
        "$.task.created_at": { "type": "iso8601" }
      },
      "state_files": {
        ".nexus/state/tasks.json": {
          "$.tasks.length": 1,
          "$.tasks[0].id": 1,
          "$.tasks[0].title": "Create fixture.schema.json",
          "$.tasks[0].status": "pending",
          "$.tasks[0].context": { "type": "string", "minLength": 1 },
          "$.tasks[0].deps.length": 0,
          "$.tasks[0].approach": "Write schema incrementally, validating against draft/2020-12 spec",
          "$.tasks[0].acceptance": "All 6 fixture files validate against the schema without errors",
          "$.tasks[0].risk": "JSONPath assertion syntax may need iteration to be harness-implementable",
          "$.tasks[0].created_at": { "type": "iso8601" }
        }
      }
    }
  },
  {
    "test_id": "task_add_with_goal",
    "description": "task_add sets the goal field on tasks.json when the goal parameter is provided on the first call",
    "covers": {
      "state_schemas": {
        "tasks.schema.json": ["goal", "decisions", "decisions[]", "tasks[].deps[]"]
      },
      "return_value": {
        "task_add": ["task"]
      }
    },
    "precondition": {
      "state_files": {
        ".nexus/state/tasks.json": {
          "goal": "Existing goal",
          "decisions": [],
          "tasks": [
            {
              "id": 1,
              "title": "Prerequisite task",
              "context": "Already created",
              "status": "pending",
              "deps": [],
              "created_at": "2026-04-12T00:00:00.000Z"
            }
          ]
        }
      }
    },
    "action": {
      "tool": "task_add",
      "params": {
        "title": "Write conformance tool fixtures",
        "context": "Create the 4 per-tool fixture files covering happy path and error cases",
        "deps": [1],
        "goal": "Ship MVP conformance fixtures for nexus-core v0.2.0",
        "decisions": ["Cover plan_start, plan_decide, task_add, task_close"]
      }
    },
    "postcondition": {
      "return_value": {
        "$.task.id": 2,
        "$.task.title": "Write conformance tool fixtures",
        "$.task.deps[0]": 1
      },
      "state_files": {
        ".nexus/state/tasks.json": {
          "$.goal": "Ship MVP conformance fixtures for nexus-core v0.2.0",
          "$.decisions.length": 1,
          "$.decisions[0]": "Cover plan_start, plan_decide, task_add, task_close",
          "$.tasks.length": 2,
          "$.tasks[1].context": { "type": "string", "minLength": 1 },
          "$.tasks[1].deps[0]": 1
        }
      }
    }
  },
  {
    "test_id": "task_add_with_owner",
    "description": "task_add persists owner, owner_agent_id, and owner_reuse_policy on the created task when those params are provided",
    "covers": {
      "state_schemas": {
        "tasks.schema.json": ["tasks[].owner", "tasks[].owner_agent_id", "tasks[].owner_reuse_policy"]
      },
      "return_value": {
        "task_add": ["task"]
      }
    },
    "precondition": {
      "state_files": {
        ".nexus/state/tasks.json": null
      }
    },
    "action": {
      "tool": "task_add",
      "params": {
        "title": "Implement core feature",
        "context": "Write the initial implementation of the feature",
        "deps": [],
        "owner": "engineer",
        "owner_agent_id": "uuid-eng01",
        "owner_reuse_policy": "resume_if_same_artifact"
      }
    },
    "postcondition": {
      "return_value": {
        "$.task.id": 1,
        "$.task.title": "Implement core feature",
        "$.task.owner": "engineer",
        "$.task.owner_agent_id": "uuid-eng01",
        "$.task.owner_reuse_policy": "resume_if_same_artifact"
      },
      "state_files": {
        ".nexus/state/tasks.json": {
          "$.tasks[0].context": { "type": "string", "minLength": 1 },
          "$.tasks[0].deps.length": 0,
          "$.tasks[0].owner": "engineer",
          "$.tasks[0].owner_agent_id": "uuid-eng01",
          "$.tasks[0].owner_reuse_policy": "resume_if_same_artifact"
        }
      }
    }
  }
]
