{
  "test_id": "full_plan_cycle",
  "description": "Verifies the complete plan → decide → task_add → close lifecycle across 5 sequential tool invocations",
  "covers": {
    "state_schemas": {
      "plan.schema.json": ["id", "topic", "issues[].id", "issues[].title", "issues[].status", "issues[].decision", "research_summary", "created_at"],
      "tasks.schema.json": ["goal", "decisions", "tasks[].id", "tasks[].title", "tasks[].status", "tasks[].plan_issue"],
      "history.schema.json": ["cycles[].completed_at", "cycles[].plan", "cycles[].plan.issues[].status", "cycles[].tasks[].id"]
    },
    "return_value": {
      "plan_start": ["created", "plan_id", "issueCount"],
      "plan_decide": ["decided", "allComplete", "remaining"],
      "task_add": ["task.id", "task.status", "task.plan_issue"],
      "task_close": ["closed", "archived.plan", "archived.decisions", "archived.tasks", "total_cycles"]
    },
    "description": "End-to-end lifecycle scenario: plan/task/history state transitions and each tool's return value across 5 sequential invocations."
  },
  "uncovered_params": ["research_summary", "issue_id", "decision", "title", "context", "deps"],
  "precondition": {
    "state_files": {
      ".nexus/state/plan.json": null,
      ".nexus/state/tasks.json": null
    }
  },
  "steps": [
    {
      "description": "Start a new plan with 2 issues",
      "action": {
        "tool": "plan_start",
        "params": {
          "topic": "Refactor state persistence layer",
          "issues": [
            "Should state files live in .nexus/state/ or project root?",
            "What is the migration path for existing users?"
          ],
          "research_summary": "Surveyed 3 consumer repos. All use .nexus/state/ already. Migration: provide a one-shot relocate script."
        }
      },
      "assert_return": {
        "$.created": true,
        "$.plan_id": { "type": "number", "min": 1 },
        "$.issueCount": 2
      },
      "assert_state": {
        ".nexus/state/plan.json": {
          "$.topic": "Refactor state persistence layer",
          "$.issues.length": 2,
          "$.issues[0].status": "pending",
          "$.issues[1].status": "pending"
        }
      }
    },
    {
      "description": "Decide issue 1 — confirm .nexus/state/ location",
      "action": {
        "tool": "plan_decide",
        "params": {
          "issue_id": 1,
          "decision": "Keep .nexus/state/ as the canonical location. Documented in state-schemas README."
        }
      },
      "assert_return": {
        "$.decided": true,
        "$.allComplete": false,
        "$.remaining.length": 1
      },
      "assert_state": {
        ".nexus/state/plan.json": {
          "$.issues[0].status": "decided",
          "$.issues[0].decision": "Keep .nexus/state/ as the canonical location. Documented in state-schemas README.",
          "$.issues[1].status": "pending"
        }
      }
    },
    {
      "description": "Decide issue 2 — confirm migration path; all issues now decided",
      "action": {
        "tool": "plan_decide",
        "params": {
          "issue_id": 2,
          "decision": "Ship a one-shot migration script as a standalone npm script. Document in RELEASING.md."
        }
      },
      "assert_return": {
        "$.decided": true,
        "$.allComplete": true
      },
      "assert_state": {
        ".nexus/state/plan.json": {
          "$.issues[0].status": "decided",
          "$.issues[1].status": "decided"
        }
      }
    },
    {
      "description": "Add a task derived from plan issue 1",
      "action": {
        "tool": "task_add",
        "params": {
          "title": "Update state-schemas README for .nexus/state/ location",
          "context": "Decision from plan: .nexus/state/ is the canonical location. Document this clearly.",
          "deps": [],
          "plan_issue": 1,
          "goal": "Land refactored state persistence layer with migration support"
        }
      },
      "assert_return": {
        "$.task.id": 1,
        "$.task.status": "pending",
        "$.task.plan_issue": 1
      },
      "assert_state": {
        ".nexus/state/tasks.json": {
          "$.goal": "Land refactored state persistence layer with migration support",
          "$.tasks.length": 1,
          "$.tasks[0].id": 1,
          "$.tasks[0].plan_issue": 1
        }
      }
    },
    {
      "description": "Close the cycle — archive plan and tasks into history, delete source files",
      "action": {
        "tool": "task_close",
        "params": {}
      },
      "assert_return": {
        "$.closed": true,
        "$.archived.plan": true,
        "$.archived.decisions": 2,
        "$.archived.tasks": 1,
        "$.total_cycles": { "type": "number", "min": 1 }
      },
      "assert_state": {
        ".nexus/state/plan.json": null,
        ".nexus/state/tasks.json": null,
        ".nexus/history.json": {
          "$.cycles.length": { "type": "number", "min": 1 },
          "$.cycles[-1].plan.topic": "Refactor state persistence layer",
          "$.cycles[-1].plan.issues.length": 2,
          "$.cycles[-1].tasks.length": 1,
          "$.cycles[-1].completed_at": { "type": "iso8601" }
        }
      }
    }
  ]
}
