{
  "test_id": "agent_spawn",
  "description": "Verifies that agent_spawn appends a new running agent entry to agent-tracker.json with required fields initialized correctly",
  "precondition": {
    "state_files": {
      ".nexus/state/runtime.json": {
        "teams_enabled": true,
        "session_started_at": "2026-04-13T00:00:00.000Z",
        "harness_id": "claude-nexus",
        "harness_version": "0.25.0"
      },
      ".nexus/state/agent-tracker.json": []
    }
  },
  "event": {
    "type": "agent_spawn",
    "params": {
      "harness_id": "claude-nexus",
      "agent_name": "architect",
      "agent_id": "uuid-eng01"
    },
    "description": "Harness spawns an agent instance and records its initial state in the agent registry"
  },
  "postcondition": {
    "state_files": {
      ".nexus/state/agent-tracker.json": {
        "$.length": 1,
        "$[0].harness_id": "claude-nexus",
        "$[0].agent_name": "architect",
        "$[0].agent_id": "uuid-eng01",
        "$[0].started_at": { "type": "iso8601" },
        "$[0].resume_count": 0,
        "$[0].status": "running"
      }
    }
  },
  "covers": {
    "state_schemas": {
      "agent-tracker.schema.json": ["harness_id", "agent_name", "agent_id", "started_at", "resume_count", "status"]
    }
  }
}
