[
  {
    "test_id": "task_list_no_tasks_file",
    "description": "task_list returns exists:false when tasks.json does not exist",
    "covers": {
      "return_value": {
        "task_list": ["exists"]
      }
    },
    "precondition": {
      "state_files": {
        ".nexus/state/tasks.json": null
      }
    },
    "action": {
      "tool": "task_list",
      "params": {}
    },
    "postcondition": {
      "return_value": {
        "$.exists": false
      }
    }
  },
  {
    "test_id": "task_list_happy_path",
    "description": "task_list returns goal, full task list, and a correct progress summary when tasks.json exists",
    "covers": {
      "return_value": {
        "task_list": ["goal", "tasks", "summary.total", "summary.completed", "summary.pending", "summary.ready"]
      }
    },
    "precondition": {
      "state_files": {
        ".nexus/state/tasks.json": {
          "goal": "Ship conformance fixtures for nexus-core",
          "decisions": ["Use declarative JSONPath assertions"],
          "tasks": [
            {
              "id": 1,
              "title": "Create fixture.schema.json",
              "context": "Define the JSON Schema for fixture files",
              "status": "completed",
              "deps": [],
              "created_at": "2026-04-12T00:00:00.000Z"
            },
            {
              "id": 2,
              "title": "Write plan_start fixture",
              "context": "Happy path and missing-research-summary error case",
              "status": "pending",
              "deps": [1],
              "created_at": "2026-04-12T00:00:00.000Z"
            },
            {
              "id": 3,
              "title": "Write task_add fixture",
              "context": "Happy path and with-goal case",
              "status": "pending",
              "deps": [1],
              "created_at": "2026-04-12T00:00:00.000Z"
            }
          ]
        }
      }
    },
    "action": {
      "tool": "task_list",
      "params": {}
    },
    "postcondition": {
      "return_value": {
        "$.goal": "Ship conformance fixtures for nexus-core",
        "$.tasks.length": 3,
        "$.summary.total": 3,
        "$.summary.completed": 1,
        "$.summary.pending": 2,
        "$.summary.ready.length": 2,
        "$.summary.ready[0]": 2,
        "$.summary.ready[1]": 3
      }
    }
  },
  {
    "test_id": "task_list_all_pending_no_deps",
    "description": "task_list marks all tasks as ready when they have no dependencies and are all pending",
    "covers": {
      "return_value": {
        "task_list": ["summary.total", "summary.pending", "summary.completed", "summary.ready"]
      }
    },
    "precondition": {
      "state_files": {
        ".nexus/state/tasks.json": {
          "goal": "Validate ready computation",
          "decisions": [],
          "tasks": [
            {
              "id": 1,
              "title": "Independent task A",
              "context": "No dependencies",
              "status": "pending",
              "deps": [],
              "created_at": "2026-04-12T00:00:00.000Z"
            },
            {
              "id": 2,
              "title": "Independent task B",
              "context": "No dependencies",
              "status": "pending",
              "deps": [],
              "created_at": "2026-04-12T00:00:00.000Z"
            }
          ]
        }
      }
    },
    "action": {
      "tool": "task_list",
      "params": {}
    },
    "postcondition": {
      "return_value": {
        "$.summary.total": 2,
        "$.summary.pending": 2,
        "$.summary.completed": 0,
        "$.summary.ready.length": 2
      }
    }
  },
  {
    "test_id": "task_list_blocked_task_not_ready",
    "description": "task_list excludes a task from ready when its dependency is still pending",
    "covers": {
      "return_value": {
        "task_list": ["summary.total", "summary.ready"]
      }
    },
    "precondition": {
      "state_files": {
        ".nexus/state/tasks.json": {
          "goal": "Validate blocked task exclusion",
          "decisions": [],
          "tasks": [
            {
              "id": 1,
              "title": "Prerequisite task",
              "context": "Must finish first",
              "status": "pending",
              "deps": [],
              "created_at": "2026-04-12T00:00:00.000Z"
            },
            {
              "id": 2,
              "title": "Dependent task",
              "context": "Cannot start until task 1 is done",
              "status": "pending",
              "deps": [1],
              "created_at": "2026-04-12T00:00:00.000Z"
            }
          ]
        }
      }
    },
    "action": {
      "tool": "task_list",
      "params": {}
    },
    "postcondition": {
      "return_value": {
        "$.summary.total": 2,
        "$.summary.ready.length": 1,
        "$.summary.ready[0]": 1
      }
    }
  }
]
